id,by,text
22999513,6510,I have an interesting fact not mentioned in the article. Vandals may put the end of the paper in the toilet before flushing. In the over orientation the paper hangs closer to the toilet and is less likely to break.
22999512,jeffbee,"That is the entire point of the post. If you leave the resolution of malloc to run time, the best you can hope for is that new calls malloc, out of line. If you build with an implementation of new, the outcomes may be dramatically better. By the way there is no such thing as std::new. We are discussing ::new."
22999511,ChrisArchitect,"was thinking about the failwhale a few weeks back when github went down and was throwing angry pink unicorns. Different, pre-coronavirus times."
22999510,petercooper,"Afraid not, though some of my work is/was hosted there! :) It's been a while though.."
22999564,benibela,"Since the oil price went negative, coffee must be the most sought commodity now"
22999563,clairity,"poor little chihuahua. hopefully someone took a chance on it! my dog also shook and was frozen scared when i first met her. she took a few minutes to take a single timid step forward. but she wasn't profoundly broken like a pair of similar-looking 6 month old siblings that were there at the same time (found in a separate hoarding situation). i saw each of them separately, and neither made any positive movements in the 20-30 minutes i spent with them. that was heartbreaking too. luckily my dog is mostly well-adjusted now, outside of those occasional anxiety episodes."
22999562,Leherenn,"And usually, most of the killing happened after the rout. Casualties during the battle proper would be surprisingly low."
22999561,decebalus1,Waiting for someone to compile an E-book with the best investment advice from /r/wallstreetbets
22999560,beckingz,... Well at least we can overwhelm them with cases.
22999559,jeffbee,"In this test jemalloc actually uses the most memory of all. With default tunings it uses 700k pages at peak, compared to 170k for tcmalloc and 131k for glibc. I have no idea if that is relevant in real life and I have never cared, so I didn't mention it."
22999558,dannygarcia,[0] https://www.pitt.edu/~dash/grimm004.html
22999557,keiferski,"All things considered, coffee is a fairly cheap hobby. At the extreme end you’ve got espresso machines and personal roasters, of course, but for the average coffee connoisseur, excellent equipment is attainable for a few hundred dollars. Sure, but this discussion is about coffee."
22999556,monkeydust,Been hooked on V60 drip for my morning coffee. Really gets the flavour out of the coffee. Worth watching a few vids on youtube to get the technique right.
22999555,pmiller2,"Why are you complaining about it when it says ""Name a fair price:"" in the price field?  Work went into compiling and laying this out, so, why shouldn't someone be able to easily pay for that if they want?"
22999553,marcinem,Thank you a lot! :)
22999552,detaro,front page: https://news.ycombinator.com/item?id=22999096
22999551,jeffbee,True.  I added a date at the top.  I wrote it this morning with head revisions of both jemalloc and tcmalloc.
22999550,DanBC,"Here's the approach in Google Maps. https://www.google.co.uk/maps/@50.863906,-1.4508162,3a,75y,2... I'd be interested to know if planting trees and bushes would help. These would reduce visibility of the other road, and would (I think) make drivers less confident about passing over the crossroads without slowing down. Also, you may be wondering about the horses wondering about. These are New Forest ponies. https://en.wikipedia.org/wiki/New_Forest_pony https://www.thenewforest.co.uk/explore/wildlife-and-nature/p..."
22999549,paulcole,Why are you even giving people the option of paying for this?
22999548,noizejoy,"lol - were you still in wikipedia editor mode when you wrote that? Or do you really feel that my comment needed a citation here on HN (Hacker News)?  And if it’s the latter, I’m genuinely curious what the proper HN etiquette would be. My comment wasn’t attempting to be particularly scholarly or to be included in a referencable work. Quite honestly, I wouldn’t know which reference to pull? Wikipedia? A highly Google ranked Psychology Today magazine article (q= difference+between+tribalism+vs+social+behaviour) ? The entire Google search result link? At least 2 of the above options might have been interpreted as condescending, and the other one an almost random pick, the randomness of it becoming a potential point of critique. So I’m genuinely curious how I might have done better."
22999547,mikewhy,"- text straight-up cuts off: https://imgur.com/uYCAxbk - very weird layout: https://imgur.com/3uFfmSW - mobile users may not even see content if they don't scroll left / right after scrolling down a bit: https://imgur.com/UQrKtcy"
22999545,Zaheer,"Although this is excellent, never substitute someone else's tips for your own financial literacy. Example: Many sites will have lists of best credit cards to have. Often they don't take into account your personal circumstances. For some, Bank of America likely has the best Credit Card available if you are a Platinum Honors tier member (>$100k combined across all accounts). With this tier, their Premium Rewards card gives me 2.62% cashback on every single purchase. I get 5.25% casback on Gas using their Cash Rewards card."
22999543,oprypin,A video by Tom Scott exploring that sentiment https://youtu.be/BxV14h0kFs0
22999542,aboodman,"Your experience doesn't match mine, either. I'll go to a lot of trouble to avoid server side development, which is partly why I love <sI think it might just be a matter of what feels like home to you."
22999541,exolymph,"No it doesn't, it just has a very broad and permissive license, because how the fuck else could the website function. Do you mean ""own"" metaphorically?"
22999540,Waterluvian,"Another guess at a third party reason: bots adding noise to their behaviour.  ""If I go clicking on everything, it'll be harder to know what my actual target was."""